{
  "contract_version": "mock-opencti-event.v1",
  "event_id": "opencti-push-ttp-001",
  "event_type": "opencti.push.attack-pattern",
  "source": "mock-opencti",
  "triggered_at": "2026-04-14T08:00:00Z",
  "summary": "Mock OPENCTI pushed a TTP hunting task focused on PowerShell execution activity aligned with MITRE ATT&CK T1059.",
  "severity": "medium",
  "labels": [
    "ttp-hunt",
    "execution",
    "t1059"
  ],
  "entity": {
    "id": "attack-pattern--10590000-0000-4000-8000-000000000001",
    "type": "attack-pattern",
    "name": "Command and Scripting Interpreter: PowerShell"
  },
  "observables": [
    {
      "type": "attack-pattern",
      "value": "T1059"
    }
  ]
}